title,company,location,time,href,description_text
"EXPERIENCED CDL-A REFRIGERATED DRIVERS WANTED in Los Angeles, California!",TWT Refrigerated,"Los Angeles, CA",11 days ago,https://job-openings.monster.com/experienced-cdl-a-refrigerated-drivers-wanted-in-los-angeles-california-los-angeles-ca-us-twt-refrigerated/d8933f13-b555-4796-a800-42651ee032f8,"DescriptionWhen our country needs it most, we’re Driving America Forward! TWT Refrigerated Service has  been hauling what builds America since 1972, keeping the country running. Join our team now in regional or over-the-road routes, and you too can haul vital goods throughout (11) eleven western states. You will drive the newest refrigerated trucks equipped with cutting edge technologies for your comfort and safety. These positions offer great pay packages, and excellent benefits like; transition and orientation pay, vacation time, medical and dental, 401K, and more.  Drive America Forward with TWT Refrigerated Service, and help keep the country running!APPLY NOW or Call 866-984-3798 to speak with a TWT Refrigerated Service Recruiter, and let us help you find the refrigerated route that fits you best! HOW TO QUALIFY:Must have a valid Class A CDLMust be 21 years of age or older6+ months of driving experience requiredIdeally 1-year truck driving experience preferredDRIVER BENEFITS: WHAT DRIVES YOU?GREAT PAY PACKAGE: Pay Packages you can plan your life around. Pick/drop pay, Pay Per Mile, and more! Weekly Pay + Direct DepositTRANSITION PAY: Offering $1,600 transition packagePAID ORIENTATION: Includes airfare, single-occupancy room, breakfast and lunch. Arrive Monday, get your truck by Thursday. It’s that easy!EXCELLENT BENEFITS:Medical/Dental401(K)Paid Vacation TimeGood Home TimeMODERN EQUIPMENT & COMFORT:Our fleet of refrigerated and heavy haul dry vans have cutting-edge technologies & best-in-class equipmentThe average age of tractors is just 2.5 yearsIncludes driver amenities & latest safety equipmentA CAREER PATH WITH TWT REFRIGERATED SERVICE: Heavy Haul or Refrigerated Trucks; Dedicated Routes with good home time, Routes throughout the western US - with team routes along the southern corridor. Or become a Driver Trainer - we provide you options.ADDITIONAL BENEFITS:OUR MODERN TRUCKS ARE METICULOUSLY MAINTAINED FOR YOUR SAFETYDRIVER PORTAL - Supporting you on the road 24/7DRIVER REFERRAL PROGRAM - Your truck driver referrals could earn you up to $1,500!SAY WHAT WE MEAN AND DO WHAT WE SAY.That’s how this company was built over 4 decades ago, and why we run over 150 trucks today. We are still family-owned, and still doing things with respect and hard-earned trust. Today, we are a temperature controlled refrigerated van line operating primarily in the 11 western states and teams servicing the southeast. In addition to our over the road fleet of refrigerated vans, we offer a northwest regional fleet providing heavy haul dry vans pulling freight up to 60,000 lbs. With customer and driver relationships that exceed 25 years, you can expect stable routes and lasting relationships that mean something at TWT. That’s how we do things. Driving means something to us here - loyalty, family, and a place to retire.DRIVING AMERICA FORWARD- COME DRIVE WITH US!Now more than ever, TWT Refrigerated Service fleets are Driving America Forward! Will you help haul America’s vital goods and materials along these important supply routes? Come drive with us - drive for better pay, excellent benefits, for your family, for your neighbors, for your community. Help keep the country running and Drive America Forward with TWT Refrigerated Service! We will see you soon…APPLY NOW or Call 866-984-3798 to speak with a TWT Refrigerated Recruiter, and let us help you find the refrigerated route that fits you best!"
"CDL-A Solo Company Driver Dry Van Opportunities in Los Angeles, California - New Pay Packages - Sign On Bonuses Available -  More home time!",Werner Enterprises,"Los Angeles, CA",11 days ago,https://job-openings.monster.com/cdl-a-solo-company-driver-dry-van-opportunities-in-los-angeles-california-new-pay-packages-sign-on-bonuses-available-more-home-time-los-angeles-ca-us-werner-enterprises/cf2417aa-af81-4943-9e96-942c5765cd17,"DescriptionWerner is seeking qualified Dry Van Company Drivers in Los Angeles, California. MORE MILES PER HOUR! New 68 mph cruising speeds to maximize safety and fuel efficieny!MORE MILES PER WEEK!  Industry-leading productions.Ask your recruiter about Relocation Bonuses!                                               WEAR BLUE TODAY!Hiring Solo and Team Drivers! Interested in teaming but no teammate? Our Team Matching Specialists will get you partnered up!! Call today! Benefits of Werner:Werner’s 401(k) company match recently doubled to _ of your first 6%Tuition Reimbursement up to $15,000 is available for those who qualifyYear-round optional rider and pet policyNewest fleet (average age 1.8 years) and well-maintained equipmentOnsite Fitness FacilitiesOnsite Recreation FacilitiesStock Purchase PlanMedical/DentalVisionBasic Life InsuranceOptional benefitsIndustry first apprenticeship programEmployee Assistance ProgramScale pre-passToll cards, cab cards and fuel cardsE-ZPass and PIKEPASS24-hour en route maintenanceTruck/diagnostic trackingLoad optimizationAssigned equipment and dispatcherWerner Enterprises understands what is important to you, the professional driver. You deserve flexibility, support and peace of mind you can count on while out on the road. That is why we offer a best-in-class benefits package that takes out all of the guesswork and puts you in the driver’s seat when it comes to the needs of you and your family.Why Drive Werner?Professional driver C. L. Werner founded Werner Enterprises with one truck in 1956. More than 60 years later, our company still remains committed to treating every driver with consideration, respect and appreciation. Managing with a driver in mind is one of Werner’s earliest founding principles, and one of the key reasons why Werner has become one of the largest truckload carriers in North America.We invest in the best at Werner, providing all of our professional drivers with more home time and competitive pay along with some of the best benefits and newest equipment in the industry. Our philosophy is to stress quality over quantity, and this principle is evident in every aspect of our company. Werner recently invested over $1 billion in our 5T’s initiative: trucks, trailers, talent, terminals and technology. While the average age of trucks in the industry is over five years, Werner’s average truck age is 1.8 years. A newer fleet means less maintenance downtime and more productive miles. As a leader in freight transportation, Werner developed the first apprenticeship program in the industry. Through this innovative work-based learning program, military community members that are eligible for VA educational benefits can receive up to $24,554.40 of tax-free benefits while enrolled in addition to their Werner pay. Werner is a proud supporter of military veterans and veteran spouses, who comprise approximately 20 percent of the company’s workforce.If you would like more information on this position, please call our Recruiting Department!APPLY NOW or Call Today for More Information!! (866) 956-8191"
Come to CRST and train to be a Class A CDL driver!,CRST Expedited,"San Marino, CA",11 days ago,https://job-openings.monster.com/come-to-crst-train-to-be-a-class-a-cdl-driver-san-marino-ca-us-crst-expedited/5748f331-2630-46b6-8dfc-caa427585ffa,"DescriptionDecide Your DestinyDo you have your Class A CDL? Are you looking for experience? CRST is hiring Recent Truck Driving School Graduates! When you drive for us, you get the freedom to decide your future. We Support You HereA Life Well LivedCRST provides one day off per week for each week on the road, tuition reimbursement, and generous benefits.Adventure AwaitsTravel across the nation as a team driver with the newest equipment in the business. Succeed at CRSTOur customized recent trucking school graduate orientation program allows you to get on the road in as little as four days.  We Love Our VeteransOur veterans earn pay rates comparable to experienced drivers and other bonuses. But wait… there’s even MORE! Guaranteed home time; one day off earned for every week outGreat benefits including medical, dental, life insurance, & 401kLongest average trucking miles in the industryRecently doubled paid layover & detention payHigh tech trucks & equipment with an average fleet age of just 18 monthsUp to $8,000 in tuition reimbursement Call and learn how fast you can build your career as a team driver! _ __866-906-7461RequirementsMust be 21 years old to apply.Qualified applicants with arrest and conviction records will be considered for employment pursuant to applicable laws."
"HIRING EXPERIENCED CDL-A FLATBED DRIVERS IN Los Angeles, California NOW!",System Transport,"Los Angeles, CA",11 days ago,https://job-openings.monster.com/hiring-experienced-cdl-a-flatbed-drivers-in-los-angeles-california-now-los-angeles-ca-us-system-transport/3edb8de3-03c1-4fc7-8a70-ef17fc4cc8f6,"DescriptionWhen our country needs it most, we’re Driving America Forward! System Transport has been hauling what builds America since 1972, keeping the country running. Join our team now in regional or over-the-road routes, and you too can haul vital goods and materials throughout the western US - including along the west coast and southwest supply routes. You will drive the newest flatbed trucks equipped with cutting edge technologies for your comfort and safety. These positions offer great pay packages, and excellent benefits like; transition and orientation pay, vacation time, medical and dental, 401K, and more. Drive America Forward with System Transport and help keep the country running!APPLY NOW or Call (866) 984-3798 to speak with a System Transport Recruiter, and let us help you find the flatbed route that fits you best!HOW TO QUALIFY:Must have a valid Class A CDLMust be 21 years of age or older5+ months of driving experience required BENEFITS: WHAT DRIVES YOU?GREAT PAY PACKAGE:Pick/drop pay, Tarp pay, Pay Per Mile, and more! Weekly Pay + Direct DepositAn Annual Pay Package that you can plan your life aroundTRANSITION PAY:We offer a $1,600 Transition Package; $800 of which is allotted for orientation for your first 2 weeks so you can focus on driving while we take care of the rest.PAID ORIENTATION:Includes airfare, single-occupancy room, breakfast and lunchArrive Monday, get your truck by Thursday. It's that easy!EXCELLENT BENEFITS:Medical/Dental401(K)Paid Vacation TimeGood Home TimeMODERN EQUIPMENT & COMFORT:The average age of tractors is just 2.5 yearsIncludes driver amenities & latest safety equipmentA CAREER PATH WITH SYSTEM TRANSPORT:Flatbed, Specialized, or Heavy-Haul we have them all!Exciting routes throughout the western US - including along the west coast and southwest.Drive alone or as a team!Dedicated routes with more home timeSpecialized fleets with more complex loads to challenge/build/improve your skills.Become a driver trainer!ADDITIONAL BENEFITS:OUR MODERN TRUCKS ARE METICULOUSLY MAINTAINED FOR YOUR SAFETY
Every tractor has a lane departure & forward collision warning system, hard brake monitoring, and a satellite communication device installed.24/7/365 road service staff & shopsIf a truck needs repairs, it's not going out until it is 100% ready to hit the road again safely with you at the wheel. You can count on that!DRIVER PORTAL: SUPPORT 24/7Award-winning app made for drivers by drivers.Receive real-time updates and alerts, access your pay, current trip data, messages/notifications, available PTO, contact information, and so much more!DRIVER REFERRAL PROGRAMYour truck driver referrals could earn you up to $1,500!WE SAY WHAT WE MEAN AND WE DO WHAT WE SAY.That's how this company was built over 4 decades ago from 1 truck to over 700 trucks today. We are still family-owned, and still doing things with respect and hard-earned trust. Today, we are the largest flatbed carrier based on the West Coast, with customer and driver relationships exceeding 25 years ensuring stable routes for our drivers and lasting relationships that mean something. That's how we do things. Driving means something to us here - loyalty, family, and a place to retire.DRIVING AMERICA FORWARD- COME DRIVE WITH US!Now more than ever, System Transport fleets are Driving America Forward! Will you help haul America’s vital goods and materials along these important supply routes? Come drive with us - drive for better pay, excellent benefits, for your family, for your neighbors, for your community. Help keep the country running and Drive America Forward with System Transport! We will see you soon...APPLY NOW or Call (866) 984-3798 to speak with a System Transport Recruiter, and let us help you find the flatbed route that fits you best!"
Sales Representative,Ingrid Arna Pty Ltd,,12 days ago,https://job-openings.monster.com/sales-representative-us-ingrid-arna-pty-ltd/218595862,"DescriptionAfter 4 years of rapid, divine growth, we’re looking to expand as we continue with our mission of helping visionary entrepreneurs create conscious wealth and global impact.  With a renowned teaching, women’s wealth advocacy, and business strategy focus, the INGRID ARNA company excels in supporting students and clients to radically grow financially and personally. And guess what? We’re hiring! We’re on the search for a FULL-TIME, heart-centered, driven, commission-based and self-motivated sales woman to join our team as one of our trusted enrollment consultants.Experienced in high ticket sales and team leadership? Read on! We’re a 24 carat gold online marketing, education, and business coaching company: we empower women in business globally with the fastest tools for growth, personally and professionally.  Keep reading if you:are focused and have excellent attention to detail. are a highly organised and effective sales master.are a master connector who loves to sell. have extensive sales experience in the personal development market. Advertising/radio sales,or high-end retail sales experience will also be considered. love to lead, coordinate, organise, control quality, and manage other sales staff.know how to deliver and give and take feedbackare a quick thinker, fast learner, and proactive action taker. have a warm nature (a sense of humor is a plus).Our sales consultants are often the first human interaction that a prospect has with our brand. We’re looking for a highly professional, empathetic, and engaging personality who has the ability to listen, guide, and inspire our prospects. By working for us, you represent our brand and must demonstrate a high level of marketing skills, service capacity, and understanding of the online space. At Ingrid Arna we DON’T DO PUSHY SALES. We have a streamlined sales process that we’ll train you in based on our method, _ THE CURRENCY OF CONNECTION.We serve coaches, thought leaders, authors, service providers, wellness experts, branding experts, copywriters, and anyone else working in the online space who wants to rapidly build their presence and revenue. Are you an ideal fit?While members of our sales team are located around the world, our head office is in Australia.This role is responsible for development and performance of exceptional sales staff to maintain a 50%+ conversion rate while running their own sales activity. Responsibilities:About 20 Inbound calls a week.Outbound calls + business development activities.Display a high level of professionalism, emotional IQ, and passion for the uprising of women in business.Live and die by the CRM for diligent follow-up with prospects and reactivating their interest.Coordinate, train, coach, recruit, support, and manage team members’ performance.Manage and refine sales processes.Weekly and monthly reporting on the team's sales data.List segmentation and campaign planning. QUALIFICATIONS5+ years of sales and customer satisfaction experience, and specifically experience with high-ticket sales ($5K+) and business program selling experience a bonus.50% minimum historical closing rate.Excellent verbal and written communication.Skilled in developing relationships and exceptional interpersonal skills.Experience using major communication platforms, CRMs, schedulers, and payment processors.Ability to work independently and in a team setting.Ability to learn and work quickly and swiftly take action to implement new ideas.Experience in setting high standards and goals for self and others and comfortable holding yourself and others accountable.Able to take ownership of the role, train others, and learn from mistakes.Someone who brings their heart and passion to the job and always arrives focused and ready to serve.BENEFITSComprehensive training, exciting incentives, and bonuses.Great company culture that encourages and supports personal growth.Experience selling a premium education and business training product. Autonomous role with a leading online education platform undergoing business expansion.  WHY WORK WITH USWe stand for the financial, social, and political empowerment of women. The pride we have in our work goes hand in hand with a culture that’s passionate, purpose driven, and good fun. At Ingrid Arna, open communication encourages contribution, community, and creativity without hierarchy. We create an environment where all our people belong and can learn and grow because we’re in the business of making a meaningful difference to the lives of our team, students, and clients—that’s at our core and is smart business. SALARYCommission based sales. We sell high ticket so you earn high commission.Does this sound like your next career opportunity?*Only successful candidates will be contacted for an interview.*If you believe you’re an epic fit and are looking to start a career with a leading online global education company that will support your own personal growth, please send your resume and cover letter.ABOUT USIngrid Arna is the authority in online digital marketing. She is the founder and CEO of The Ingrid Arna Company and the creator of the Gucci of online business programs, High-End Empire, Six-Figure Diva, and Million Dollar Media. Ingrid’s work has landed coverage in print and broadcast outlets around the world, including Forbes, Cosmopolitan, InStyle, The Huffington Post, Good Health Magazine, Fox News and on The Steve Harvey Show. To learn more about Ingrid Arna, visit www.ingridarna.com"
NEW PAY PACKAGE - Company Drivers Apply and Earn More!,Melton Truck Lines,"Los Angeles, CA",11 days ago,https://job-openings.monster.com/new-pay-package-company-drivers-apply-earn-more-los-angeles-ca-us-melton-truck-lines/33f68d10-edf0-41b0-958b-e1ee35a1a345,"DescriptionBased out of Tulsa, OK, Melton Truck Lines is known for treating its drivers like family. Melton has been running more than 66 years with a reputation of excellence and stability in the trucking industry. Melton aims to remain ahead of the competition with free on-site clinics and dentists, 24/7 driver help desk, rider and pet programs, and much more.With our industry high new base pay, per diem plan, extra pay for tarping, OD, hazmat, and Canada loads, Melton’s pay and benefits package can’t be beat! Pay:Entry Level   -   46¢ per mile1-5 months OTR or 4 mos local  -  47¢ per mile6-8 months OTR   -   48¢ per mile9-11 months OTR     -    49¢ per mile1-3 years OTR   -   51¢ per mile3+ years OTR   -   52¢ per mile Paid Training:Drivers will be placed in a customized orientation program based on their experience.As an extra precaution for our current and future drivers, in addition to following CDC guidelines to help prevent and slow the spread of COVID-19, Melton is not currently hiring entry level drivers that are required to go out with a trainer (less than 5 months OTR experience) at this time. However, if you would like a recruiter to follow up with you about driving opportunities with Melton when our trainee program is open or once you reach 5 months OTR experience, please give our team a call. Benefits:Comprehensive health, dental, and vision coverageFree on-site health clinics and dental exams401(k) retirement programOn-site gym, workout facilities, and personal trainerDedicated driver services team24/7 safety helplineMDLive - professional medical assistance from anywhereFlexible home domicilePet Program – 90 lbs or less dog or catRider Program – 18+ years old year-round, 10+ years old during summer months RequirementsCDL-AMinimum 21 Years Old"
Sr DevOps/Cloud Engineer,"Tentek, Inc","Burbank, CA",23 days ago,https://job-openings.monster.com/sr-devops-cloud-engineer-burbank-ca-us-tentek-inc/218441613,"DescriptionDuration: 18 MonthsLocal W2 candidates only.Responsibilities:Architect, build, and operate high-quality production systemsWork with application team transitioning applications to cloud-hybrid environment.Build infrastructure in Terraform involving coding, heavy scripting and automation.Design systems to enable rapid development, high availability, and clear observabilityMaintain, and improve, the reliability and operability of servicesWrite tools, and leverage open source, to automate tasks with an emphasis on safety and repeatabilityTroubleshoot and resolve performance and reliability issues across the stack, including cloud resourcesCollaborate with engineers to ensure services are designed to be cloud-native, scalable, and easily operatedIdentify & evangelize new technologies, patterns, solutions, and best practicesCreate self-healing infrastructure-as-Code, and automate everythingEnsure security best practice is at the forefront is embedded in our DNA of all your design       Qualifications:   Experience working in media production environmentsSmart, self-driven with a keen focus on and track record of exceptional delivery of innovative solutionsStrong written and verbal communication skillsSkilled comfortable working with public cloud service provider (e.g. AWS, Google Cloud Compute). AWS preferred.Strong knowledge in system management languages (e.g. Chef, Terraform, Ansible). Terraform preferred.Operating systems and systems management (e.g. Red Hat, CentOS, Ubuntu, Windows).  Exp with Red Hat a plus.Multiple scripting languages in your toolbox (e.g. Python, GO, Ruby, or Swift)Authentication tool-sets such as Active Directory, LDAP, Ping IdentityLocal and Networked File Systems (e.g. SMB, SMBv3, NFS, CIFS)Client operation systems and configuration management toolsServer and client backup technologies, and image managementVirtual hosting technologies (e.g. VMWare, KVM)Data center, network, and application architecturesHigh performance data storage solutions whether SAN, NAS, or Clustered (e.g. Isilon)Systems Security (e.g. key management, encryption, vulnerability management)Containerization and Container PaaS offerings (e.g. Docker, Rancher, Kubernetes, OpenShift).  Kubernetes and OpenShift preferred.Strong experience in developing monitoring, measurements, and tuning systems for optimal performance and 24/7 reliabilityThorough knowledge of continuous integration tools (e.g. Jenkins, Bamboo). Jenkins preferred.Passion to exploit technology and constantly learnExceptional analytical and problem-solving skillsStrong oral and written communication skills"
Telemetry Registered Nurse (Tele RN),Incredible Health,"Inglewood, CA",4 days ago,https://job-openings.monster.com/telemetry-registered-nurse-tele-rn-inglewood-ca-us-incredible-health/01ced9c0-046e-461e-adf9-e9034e312568,"DescriptionTelemetry Registered Nurse (Tele RN) - Salaries up to $180k/yearIncludes Prime Healthcare, USC Keck, Cedars-Sinai, Stanford, UCSF, and UC Davis. Job Summary:* Looking for Telemetry RN for permanent roles in California hospitals, including Inglewood, Los Angeles and San Francisco Bay areas. * Hospitals include all major academic centers in California.Responsibilities and Duties:* Tasks expected of a Telemetry RN.Qualifications and Skills:* Acute care experience* Active California licenseBenefits:Full Benefits including* Healthcare coverage* Sign on bonuses* 401K, with matching* Tuition reimbursement* Relocation bonuses* Professional development and career advancement opportunitiesJob Type: Full-timeSalary: $120,000.00 to $180,000.00 /yearRequired experience:* Acute care: 1 year* Registered nurse: 1 year* California license"
