title,company,location,time,href,description_text
Relationship Banker I - Valley-Stoneman Br.,Cathay Bank,"Alhambra, CA",2 days ago,https://job-openings.monster.com/relationship-banker-i-valley-stoneman-br-alhambra-ca-us-cathay-bank/218699082,"DescriptionGENERAL SUMMARYResponsible for primarily handling teller transactions, providing operational support, cross-selling bank products/services, and resolving customer service issues. Process transactions with accuracy and efficiency while delivering an overall professional and exceptional customer experience. As needed, will open accounts and refer customers to other areas of the bank as appropriate.  Follow regulations and bank security procedures to protect customers as well as minimize risk to the bank.ESSENTIAL FUNCTIONSOperations:Perform deposits and withdrawal transactions.Reconcile and balance teller cash drawer.Process outgoing wires.Essential functions of Safe Deposit box (e.g. entry, opening, maintenance).Assist customers with problem resolution.Assist in ATM balancing.Detect and report fraudulent or suspicious activities by completing BSA reporting as required, Currency Transactions Reports or Monetary Instrument Reports.New Accounts:Perform all aspects of new account opening procedures for all bank products/services.Answer customer inquiries, make appropriate financial solutions and recommendations and assist with problem resolution.Perform customer service functions such as check orders, change of address, return mail processing, supersede signature cards, and other account maintenance changes.Maintain confidentiality of customer information as well as Bank proprietary information.Sales and Service:Identify sales opportunities to cross-sell bank products and services to ensure customers’ financial goals are met.Provide quality personalized customer service, maintain frequent customer contact to expand relationships and ensure customer retention. Maintain open communication with Bank business partners and make referrals as appropriate (e.g. Financial Advisors, Mortgage Loan Originators, Commercial Lenders).Proactively support branch new business promotions.QUALIFICATIONS College degree in business, accounting or finance preferred or related work experience. 6-12 months of cash handling, customer service in a retail environment, or sales experience preferred.  Banking experience is a plus.  Desire to learn the banking industry, help others, and work in a professional environment.  PC literate and typing proficient. Previous experience with data entry, 10-key, banking software, and Microsoft Word, Excel, PowerPoint and Outlook a plus.  Detail-oriented and organized with good note taking and follow-up skills.  Good oral and written communication skills – can write clear messages, initiate conversations, and talk to customers about products and services.  Good listening and interpersonal skills – can listen without interrupting, seeks clarification, responds professionally, and keeps emotions under control in difficult situations.  Ability to work independently and as part of team.  Ability to give and receive feedback to improve skills and job knowledge.  Can maintain good attendance and arrive consistently at scheduled start time.  Bilingual English/Chinese (Mandarin or Cantonese) preferred. Able and willing to commute as required for business needs."
SSIS ETL Lead,Mindtree Ltd,"Pasadena, CA",5 days ago,https://job-openings.monster.com/ssis-etl-lead-pasadena-ca-us-mindtree-ltd/218751561,"DescriptionSSIS ETL LeadCompany Name: Mindtree Work Location: Pasadena, CADesired Candidate Profile8+ years of DW Project execution experience and very strong understanding of DW conceptsHands On development experience in Microsoft SQL Server 2012, TSQL & SSISVery Strong Analytical skillsGood Communication skillPrior experience in data analysis and SQL query tuningGood understanding of Dimensional Data ModellingWorked in Onsite-Offshore delivery modelPreferable – Banking and Financial domain experienceDevelopment  experience in SSASQualificationsSSISSSRSSSASDW concepts Experience Required 10+ years of industry experience Educational QualificationsTechnical degree required; computer science or electronics engineering degree desired;IndustryInformation Technology and ServicesEmployment TypeFull-time Mindtree Equal Employment Opportunity PolicyMindtree provides equal employment opportunities to all employees and applicants for employment without regard to race, color, religion, sex, national origin, age, disability or genetics.Why Work with Us:Recognized for our employee learning and talent development practicesGood work-life balance encouragedRecognition is the cornerstone of our cultureValues-driven and engaged leadership About Mindtree              Mindtree [NSE: MINDTREE] is a global technology consulting and services company, helping enterprises marry scale with agility to achieve competitive advantage. “Born digital,” in 1999 and now a Larsen & Toubro Group Company, Mindtree applies its deep domain knowledge to 300+ enterprise client engagements to break down silos, make sense of digital complexity and bring new initiatives to market faster. We enable IT to move at the speed of business, leveraging emerging technologies and the efficiencies of Continuous Delivery to spur business innovation. Operating in 18 countries and over 40 offices across the world, we’re consistently regarded as one of the best places to work, embodied every day by our winning culture made up of over 21,000 entrepreneurial, collaborative and dedicated “Mindtree Minds.” Welcome to possible!"
UI/UX Designer,enexusglobal,"South pasadena, CA",5 days ago,https://job-openings.monster.com/ui-ux-designer-south-pasadena-ca-us-enexusglobal/218762023,"DescriptionStrong experience in Mobile UI   Requirements:  Minimum of 3-5 years of UX Design/Product Design experience Expert in App Design and Interaction Design, Strong in Visual Design - able to apply elements from an existing Design System to ensure consistency with a broad suite of applications. Expert in Sketch, Zeplin, and InVision Proficient in prototyping tools such as Framer, Flinto, Axure or Principle Experience working with iOS App/Human Interface Guidelines Familiarity with iOS enough to understand if what you are designing can be built. More experience hands-on with development is always a plus but not expected to code. Excels at pairing side-by-side with Developers to ensure implementation meets the design intent. Demonstrable skills with reviewing implemented work, providing pointed feedback and holding the cross-functional team accountable to delivering the application as designed - ensuring it matches the designs created or where needed engaging in the discussion with the team and UX management on deviations based on input during the development process. Experience gathering input from end-users and conducting or participating in usability testing and needs-finding research. A strong portfolio that demonstrates your experience creating user-centered design solutions. Detail-oriented and have excellent work-file organization.  Difference between good and great candidate:  Capable of understanding and articulating the business need and the user need and translating both into an elegant solution that solves for both parties. Knows how to learn the user need through gathering data and insights (rather than inferring or using personal bias). Capable of both advocating for the user while understanding where to compromise to meet business goals. Possesses ability to articulate design solutions and intentions based on research, usability practices and business values. Able to persuade stakeholders of various groups in the company of the validity of an approach and facilitate discussions as a partner with a cross functional focus on meeting user and business goals. Team player who is comfortable with daily standups and actively engaged in regular meetings to define the solution together. Outcome focused team player who is comfortable with daily standups and is actively engaged in the full process to define and ship the solution."
OCM - Lead,"Ekman Associates, Inc.","Los Angeles, CA",6 days ago,https://job-openings.monster.com/ocm-lead-los-angeles-ca-us-ekman-associates-inc/218734571,"Description Job DescriptionTitle:               Organizational Change Management Location:        Los Angeles, CA Ekman Associates, Inc. is a Southern California based company focused on the following services: Management Consulting, Professional Staffing Solutions, Executive Recruiting and Managed Services. Summary:The Organizational Change Management role is responsible for developing a change management process with a structured methodology to create a strategy that will support adoption of the changes required by a new project implementation. Responsibilities: Responsible for the delivery of effective change management, which includes the development, tailoring, and application of a structured methodology and strategy based on situational awareness targeted at groups being impacted by the change(s).Lead and implement change initiatives related to business processes and technologies.Develop project strategies and plans, including stakeholder assessment, communications, leadership alignment, organization transition, change readiness, capability transfer, and end-user training.Develop short and long-term goals, KPIs, and objectives, and develop and execute against annual operational plan.Lead/facilitate meetings to ensure an understanding of the current company culture, and jointly develop a change adoption plan.Create process models, specifications, narratives, diagrams, and charts to provide direction to the program team.Direct the creation and development of implementation readiness materials.Act as a coach for business process owners in helping fulfill the role of change sponsor.Deliver internal change management activities to ensure ongoing stakeholder and user engagement, as well as articulate the ways in which changes will affect the users on a day-to-day basis. Identify project stakeholders, stakeholder characteristics, and associated change impacts.Track and report issues / risks and develop risk mitigation strategies and tactics.Document the existing processes and changes to the processesContribute to the program and project planning with change management related activitiesPerform the impact analysis from a change management perspectivePerform change management activities like stakeholder mapping and analysis, communication planning and execution, training plan creation and execution.Develop training approach including logistics, curriculum, materials, communication and executionMust be able to operate strategically as well as tactically and be willing to roll-up sleeves as neededQualifications:Bachelor’s Degree in Computer Science, Information Systems, Business Administration or another related field, and coursework in Organizational Change Management preferredChange Management Certified is preferredA solid understanding of how people go through a change and the change processExperience and knowledge of change management principles, methodologies and toolsExperience in project management and in bringing innovative ideas to realityExperience consulting and communicating with senior management teamsResults-oriented and customer-focused. Demonstrated ability to develop effective working relationships with external and internal customers, including senior managementStrong, decisive leader with the ability to drive and manage changeStrong interpersonal skills and the ability to adapt to a complex and changing environmentExperience working with detailed technical information and with technology; hands-onExceptional communication skills, both written and verbalExcellent active listening skillsExperience with large-scale organizational change effortsAble to work effectively at all levels in an organizationMust be a team player and able to work collaboratively with and through othersExcellent time management, interpersonal, listening, communication, presentation, organizational and financial skills.Qualified Candidates Only: If you wish to learn more about this opportunity and additional qualifications/responsibilities, please submit your resume.  To learn more about Ekman Associates, Inc. please visit our website at www.ekmanassociates.com."
Sr. Managed Care Contract Administrator,AHMC Healthcare Inc,"Alhambra, CA",10 days ago,https://job-openings.monster.com/sr-managed-care-contract-administrator-alhambra-ca-us-ahmc-healthcare-inc/218409104,"Description     Position Title:SR. MANAGED CARE CONTRACT ADMINISTRATORJob Code:XC4540Department:CORPORATESalary Grade: Reports To:CORPORATE MANAGER OF MANAGED CARE CONTRACTINGExempt/Non:  Exempt Effective Date: 11/1/2013 Revised Date: 6/18/2020                      Position Summary The Sr. Managed Care Contract Administratoris responsible for performing a full range of contract administration functions, focused on flawless execution of contract responsibilities.  The Sr. Managed Care Contract Administrator will as the agent of the company lead the program team in proposal activities, negotiations and all other miscellaneous contract activities and duties.  This position receives, processes, and releases contracts; reviews and negotiates terms and conditions; maintains contract files and supports Managed Care in all facets of contracting with ancillary providers, individual physician providers, health plans (HMO, EPO and PPO), medical groups, IPAs and hospitals.  This position conducts and reviewsmodeling, contract rate analysis, risk pool financial statements and analysesand ad hoc financial projects and rate analyses.  The Managed Care Contract Administrator also conducts joint operations meetings between hospitals and groups/IPAs, health plans and education meetings among hospital staff and various departments as assigned. AHMC provides consulting services to seven acute care hospitals: AHMC Anaheim Regional Medical Center with 223 beds, Garfield Medical Center with 210 beds, Greater El Monte Community Hospital with 117 beds, Monterey Park Hospital with 101 beds, Parkview Community Hospital with 191 beds, San Gabriel Valley Medical Center with 273 beds, and Whittier Hospital Medical Center with 178 beds. The facilities are Medicare and Medi-Cal certified and accredited by the Joint Commission on Accreditation of Healthcare Organizations.  The hospitals provide healthcare services reimbursed by Medicare, Medi-Cal, traditional insurance plans, PPO, HMO and under capitated arrangements.   Training/Experience 5+ years of related contracts experience; Managed Care negotiations preferredStrong knowledge of basic contract terminology, key provisions and/or reimbursement methodologies including capitationKnowledge of the structure of the health care industry, including provider systems (PPOs and EPOs), IPAs and acute hospital Managed Care operationsExperience researching compliance issues, applicable regulations and laws and formulating recommendations to managementAbility to interpret reimbursement information and salient terms from complex legal documents in healthcareAbility to communicate persuasively and diplomatically both verbally and in writingAbility to think analytically and logicallyProficient in Microsoft Word, Excel, and PowerPoint required; database experience preferred    Education/certification/license Bachelor’s degree in Business Administration, HealthCareAdministration or related concentration; graduate degree preferred.NCMA certification (CPCM or CFCM) preferred   Essential Job Functions  Negotiate contracts between ancillary providers,  health plans (EPO and PPO), medical groups/IPAs and hospitalsParticipate in contract negotiations between ancillary providers, health plans (EPO and PPO), medical groups/IPAs, individual physician providers and hospitals.Develop and review contract modeling and contract rate analyses.Prepare contract approval forms supporting submission of agreements for execution.Draft specialized RFP templates, agreements and amendments for vendor and client contracting.Review risk pool financial statements and analyses and ad hoc financial projects rate analyses.Develop and maintain templates as directed by attorney.Manage proposal(s) and final documents during negotiations.Preview contracts for acceptability of provisions and act as interface between negotiators and attorneys.Follow internal policies and procedures to ensure complianceConduct joint operations meetings between hospitals and IPA groups.Conduct joint operations meetings with health plans.Conduct educational meetings and/or training, in-service and staff meetings as requested.Participate in employee recognition programs.Abide by the hospital’s Code of Conduct, Policy and Procedures and HIPPA compliance.Perform additional duties as assigned.       physical Demand AnalysisEssential Functions  Explanation:  Each physical requirement is rated on a frequency scale of 0-3 to reflect the requirements for normal working hours.  Reasonable accommodations will be made as necessary. Physical Requirements Frequency rating:0.  None (0%)    1.  Occasional (1-33%)    2.  Frequently (34-66%)    3.  Constant (67-100%)A.  Sitting3I.  Wrist Deviation (Side to Side)3B.  Standing1J.  Hand/Wrist Repetitions (Up/Down)2C.  Walking1K.  Reaching1D.  GraspingSimple:  < 50 poundsFirm:  >50 pounds 10L.  Manual Dexterity/StrengthGross motor, light-moderate strengthGross motor, moderate -heavy strengthFine motor, light - moderate strengthFine motor, moderate-heavy strength 1111E.  Squatting/Kneeling/Crawling/Climbing1M.  Twisting/Bending1F.  PullingUp to 10 lb.Up to 25 lb.Up to 50 lb.Up to 100 lb.Over 100 lb. 10000N.  Lifts and CarriesUp to 10 lb.Up to 25 lb.Up to 50 lb.Up to 100 lb.Over 100 lb. 10000G.  Lifts OverheadUp to 10 lb.Up to 25 lb.Up to 50 lb.Up to 100 lb.Over 100 lb. 10000O.  PushingUp to 10 lb.Up to 25 lb.Up to 50 lb.Up to 100 lb.Over 100 lb. 00000H.  Visual RequirementsClose eye work (small figures)Color discrimination     Minimal color discrimination     Normal color discriminationOther _________________ 2 NoNo P.  Hearing RequirementsSpecial requirements (please specify)Normal hearing required.  Full fill communication needs telephones/verbal request/clear acuity required within 100 feet.  0WORKING CONDITIONS   Q. Non-Ionizing Radiation(welding flash, microwaves, sun)0T.    Ionizing Radiation(x-ray, radioactive isotopes)0R.   Hazardous Exposure(chemical [e.g. latex] and infectious)0U.   Personal Protective Equipment(e.g. respiratory mask, lead apron, etc.)0S.  Driving1V.  Other: ____________________"
Web and Graphic Designer,Quick USA,"Los Angeles, CA",17 days ago,https://job-openings.monster.com/web-graphic-designer-los-angeles-ca-us-quick-usa/218551214,"DescriptionBasic Qualification:2+ years of modern web development experience.Knowledge of current front-end web technologies: HTML5, CSS3Ability to manage multiple parallel projects and delivering quality releases on schedule.Strong communication skills, specifically with explaining technical concepts to a non-technical audiencePreferred Qualification:B2B technical marketing experience.Ability to manage multiple parallel projects and delivering quality releases on schedule.Knowledge of implementing web analytics.Ability to write and design web landing pages and experiences.Video editing experience.Job Duties:Ability to create clean, maintainable code using HTML, CSS that works perfectly in all major web browsers.Develop, adapt and maintain print and online sales/marketing collateral, including advertisement, brochures, website, email campaigns, social media, motion graphic videos and other materials as needed.Collaborate with Sales & Marketing to create compelling design concepts, artwork and layouts for multi-channel and integrated marketing efforts.Proficient in Adobe CC: Photoshop, Illustrator, PremiereGood conceptual design, layout and production skills.Self-starter, work with quick time constraints and stay organized.Multi-task while maintaining extreme attention to detail and quality control.Positive, upbeat communication and interpersonal attitude.Experience with advanced SEO/SEM methods."
